word,mbti
writing letter composition authoring scripting text penning wordcraft listen understand care hear accept attend obey perceive,I
communication communicate verbalize expression speech language converse speak utterance communicate dialogue conversation discuss dialogue confer,E
melody song music rhythm harmony inevitable impractical voice reckless difficult tune unattainable impossible unachievable insurmountable,S
lyrics verses songwriting words poetry lines rhyme possible achievable viable practicable text feasible composition potential realizable,N
what style hair acknowledgment recognition appreciation happiness proud recognition talent,T
process sympathy why comfort unfair work upset evaluation warmth,F
no troublesome impromptu now freedom okay sir free,P
yes storage internet plan check record disappointment embarrassment place anger ready rules,J
